<?xml version="1.0" encoding="UTF-8"?>
<pedido  xmlns:xsi="http://www.w3.org/2001/XMLSchema-instance"
	xsi:noNamespaceSchemaLocation="pedidos.xsd" idorden="009654">
	<remitente>Carlos Fdez Tessier</remitente>
	<receptor>
		<nombre>Maria Guerrero García</nombre>
		<direccion>Calle sagasta numero 14</direccion>
		<ciudad>Madrid</ciudad>
		<pais>España</pais>
	</receptor>
	<libro>
		<titulo>La Espada de Joram. Volumen 1: La forja</titulo>
		<notas>
			Edición coleccionista
		</notas>
			<cantidad>1</cantidad>
			<precio>10.90</precio>
	</libro>
	<libro>
		<titulo>La Espada de Joram. Volumen 2:La profecia</titulo>
		<cantidad>1</cantidad>
		<precio>9.90</precio>
	</libro>
</pedido>


